{
  "$schema": "https://json-schema.org/draft/2020-12/schema",
  "$id": "https://storycore.local/schemas/music-plan-v1.schema.json",
  "title": "StoryCore MusicPlan v1",
  "type": "object",
  "additionalProperties": false,
  "required": [
    "schema_version",
    "plan_id",
    "mode",
    "duration_seconds",
    "sections",
    "sync_cues",
    "provenance"
  ],
  "properties": {
    "schema_version": {"const": 1},
    "plan_id": {"type": "string", "minLength": 1, "maxLength": 128},
    "mode": {"enum": ["full", "guided", "free"]},
    "title": {"type": "string", "maxLength": 256},
    "narrative_intent": {"type": "string", "maxLength": 4000},
    "duration_seconds": {"type": "number", "exclusiveMinimum": 0, "maximum": 7200},
    "tempo_bpm": {"type": ["number", "null"], "minimum": 20, "maximum": 300},
    "meter": {"type": ["string", "null"], "maxLength": 32},
    "tonal_center": {"type": ["string", "null"], "maxLength": 64},
    "sections": {
      "type": "array",
      "minItems": 1,
      "maxItems": 128,
      "items": {
        "type": "object",
        "additionalProperties": false,
        "required": ["id", "start_seconds", "end_seconds", "purpose"],
        "properties": {
          "id": {"type": "string", "minLength": 1, "maxLength": 128},
          "start_seconds": {"type": "number", "minimum": 0},
          "end_seconds": {"type": "number", "exclusiveMinimum": 0},
          "purpose": {"type": "string", "minLength": 1, "maxLength": 1000},
          "energy": {"type": ["number", "null"], "minimum": 0, "maximum": 1},
          "tension": {"type": ["number", "null"], "minimum": 0, "maximum": 1},
          "dialogue_safe": {"type": "boolean", "default": false},
          "motif_refs": {
            "type": "array",
            "items": {"type": "string", "minLength": 1, "maxLength": 128},
            "uniqueItems": true,
            "default": []
          },
          "instrument_roles": {
            "type": "array",
            "items": {"type": "string", "minLength": 1, "maxLength": 128},
            "uniqueItems": true,
            "default": []
          }
        }
      }
    },
    "motifs": {
      "type": "array",
      "maxItems": 64,
      "items": {
        "type": "object",
        "additionalProperties": false,
        "required": ["id", "intent"],
        "properties": {
          "id": {"type": "string", "minLength": 1, "maxLength": 128},
          "intent": {"type": "string", "minLength": 1, "maxLength": 1000},
          "symbolic_hint": {"type": ["string", "null"], "maxLength": 2000}
        }
      },
      "default": []
    },
    "sync_cues": {
      "type": "array",
      "maxItems": 256,
      "items": {
        "type": "object",
        "additionalProperties": false,
        "required": ["id", "time_seconds", "intent"],
        "properties": {
          "id": {"type": "string", "minLength": 1, "maxLength": 128},
          "time_seconds": {"type": "number", "minimum": 0},
          "intent": {"type": "string", "minLength": 1, "maxLength": 1000},
          "story_ref": {"type": ["string", "null"], "maxLength": 512}
        }
      }
    },
    "lyrics": {
      "type": ["object", "null"],
      "additionalProperties": false,
      "required": ["language", "text"],
      "properties": {
        "language": {"type": "string", "minLength": 2, "maxLength": 35},
        "text": {"type": "string", "maxLength": 20000}
      }
    },
    "provenance": {
      "type": "object",
      "additionalProperties": false,
      "required": ["commercial_target", "dependencies"],
      "properties": {
        "commercial_target": {"type": "boolean"},
        "dependencies": {
          "type": "array",
          "maxItems": 128,
          "items": {
            "type": "object",
            "additionalProperties": false,
            "required": ["name", "kind", "license"],
            "properties": {
              "name": {"type": "string", "minLength": 1, "maxLength": 256},
              "kind": {"enum": ["code", "model-weights", "dataset", "asset", "other"]},
              "license": {"type": "string", "minLength": 1, "maxLength": 256},
              "version": {"type": ["string", "null"], "maxLength": 128},
              "source": {"type": ["string", "null"], "maxLength": 1000}
            }
          }
        }
      }
    }
  }
}
